{
  "protocol_version": 1,
  "kind": "result",
  "job_id": "j_01JZ8Y3K5M7Q9R1T3V5X7Z9B2D",
  "attempt_id": "a_8BEC8GCSGSVYW5QDNF7FCHF1BZ",
  "attempt_no": 1,
  "worker_epoch": 3,
  "outcome": "failed",
  "phase_reached": "validate",
  "exit": {
    "kind": "not_started",
    "code": null,
    "signal": null
  },
  "error_class": "validation_error",
  "bundle_sha256": null,
  "adapter": null,
  "toolchain": {
    "worker_version": "0.1.0",
    "toolchain_id": "tc-2026-10-a",
    "browser": null,
    "encoder": null
  },
  "device": {
    "gpu_query": "not_attempted",
    "gpu_vendor": null,
    "gpu_model": null,
    "software_fallback": null,
    "gpu_busy_observed": null,
    "vram_peak_mb": null
  },
  "frames": {
    "expected": null,
    "rendered": 0
  },
  "timings_ms": {
    "total": 5
  },
  "artifacts": [
    {
      "artifact_id": "log",
      "kind": "log",
      "media_type": "text/plain",
      "delivery": "uploaded",
      "size_bytes": 200,
      "sha256": "f9de26ff28d2059f38a053ca868bea84be1e8d5071fe428ba2f2af50884e240f"
    }
  ],
  "local_text_check": {
    "rules_version": 1,
    "passed": true
  }
}
