{
  "protocol_version": 1,
  "kind": "result",
  "job_id": "j_01JZ8Y3K5M7Q9R1T3V5X7Z9B2D",
  "attempt_id": "a_8BEC8GCSGSVYW5QDNF7FCHF1BZ",
  "attempt_no": 1,
  "worker_epoch": 3,
  "outcome": "failed",
  "phase_reached": "prepare",
  "exit": {
    "kind": "not_started",
    "code": null,
    "signal": null
  },
  "error_class": "adapter_error",
  "bundle_sha256": "f26d779da80c23289b293d2aed6c8508d9353433aae4db02cffe02afb34d4aa2",
  "adapter": {
    "id": "webgl-frames",
    "version": "0.1.0"
  },
  "toolchain": {
    "worker_version": "0.1.0",
    "toolchain_id": null,
    "browser": null,
    "encoder": null
  },
  "device": {
    "gpu_query": "not_attempted",
    "gpu_vendor": null,
    "gpu_model": null,
    "software_fallback": null,
    "gpu_busy_observed": null,
    "vram_peak_mb": null
  },
  "frames": {
    "expected": 3,
    "rendered": 0
  },
  "timings_ms": {
    "prepare": 40,
    "total": 45
  },
  "artifacts": [
    {
      "artifact_id": "log",
      "kind": "log",
      "media_type": "text/plain",
      "delivery": "uploaded",
      "size_bytes": 400,
      "sha256": "a5ec048f83cfa04e41ef4545f768d78f4b644c86d9518f035350fc5bfd26f777"
    }
  ],
  "local_text_check": {
    "rules_version": 1,
    "passed": true
  }
}
